{"id":"okinawa-midterm-indicator-review-manifest","prefecture_code":"47","municipality_key":"okinawa-prefecture","plan_title":"新・沖縄21世紀ビジョン実施計画（中期）","plan_period":"令和7年度～令和9年度","source_url":"https://www.pref.okinawa.jp/_res/projects/default_project/_page_/001/034/436/7_tyukijisshikeikaku_r2.pdf","source_document_title":"新・沖縄21世紀ビジョン実施計画（中期）附属資料","reviewed_indicator_count":376,"major_indicator_count":37,"outcome_indicator_count":339,"evidence_packet_count":376,"national_comparator_present_count":174,"remote_island_indicator_count":32,"sdgs_linked_indicator_count":43,"qualitative_target_count":9,"duplicate_indicator_name_count":0,"duplicate_indicator_names":{},"activity_indicator_included_count":0,"policy_achievement_assessed_indicator_count":0,"status":"complete","updated_at":"2026-07-22","next_review_scope":"PDCA実施結果と基本計画評価検証報告書を、主要指標・成果指標へ定義照合して年度実績として接続する。","quality_note":"主要指標37件と成果指標339件を別レイヤーで保持し、活動指標は年度事業量として除外する。全国値、離島指標、SDGs優先課題、定性目標、複数系列を単一スコアへ変換しない。"}